co_cnes,co_ibge,nu_cnpj_mantenedora,razao_social_mantenedora,no_razao_social,no_fantasia,ds_tipo_unidade,ds_natureza_organizacao,ds_esfera_administrativa,tp_gestao,no_logradouro,nu_endereco,no_bairro,co_cep,regiao,uf,municipio,nu_telefone,ds_turno_atendimento,ds_servico_especializado,lat,long,origem_coord
11150,530010,00394700000108,SECRETARIA DE ESTADO DE SAUDE DO DISTRITO FEDERAL,UNIDADE BASICA DE SAUDE N 2 ASA SUL,UBS 02 ASA SUL,CENTRO DE SAUDE/UNIDADE BASICA,,,E,SGAS QUADRA 612 LOTES,S/N,ASA SUL,70200720,Centro-Oeste,DF,Brasília,(61) 33452873,ATENDIMENTOS NOS TURNOS DA MANHA E A TARDE,"SERVICO DE PRATICAS INTEGRATIVAS E COMPLEMENTARES| SERVICO DE PRATICAS INTEGRATIVAS E COMPLEMENTARES| SERVICO DE VIGILANCIA EM SAUDE| SERVICO DE ATENCAO AO PRE-NATAL, PARTO E NASCIMENTO| SERVICO DE PRATICAS INTEGRATIVAS E COMPLEMENTARES| ATENÇÃO ÀS PESSOAS EM SITUAÇÃO DE VIOLENCIA SEXUAL| SERVICO DE ATENCAO AO PACIENTE COM TUBERCULOSE",-15.8326828479762,-47.9096817970262,PMAQ
10456,530010,00394700000108,SECRETARIA DE ESTADO DE SAUDE DO DISTRITO FEDERAL,DISTRITO FEDERAL SECRETARIA DE SAUDE,HBDF HOSPITAL DE BASE DO DISTRITO FEDERAL,HOSPITAL GERAL,,,E,SMHS QUADRA,101,PLANO PILOTO,70310500,Centro-Oeste,DF,Brasília,61 3254050,"ATENDIMENTO CONTINUO DE 24 HORAS/DIA (PLANTAO:INCLUI SABADOS, DOMINGOS E FERIADOS)","SERVICO DE OFTALMOLOGIA| SERVICO DE REABILITACAO| SERVICO DE ATENCAO EM NEUROLOGIA / NEUROCIRURGIA| SERVICO DE ORTESES, PROTESES E MAT ESPECIAIS EM REABILITACAO| TRANSPLANTE| SERVICO DE FISIOTERAPIA| SERVICO DE DIAGNOSTICO POR METODOS GRAFICOS DINAMICOS| SERVICO DE DIAGNOSTICO POR LABORATORIO CLINICO| SERVICO DE ATENCAO CARDIOVASCULAR / CARDIOLOGIA| SERVICO DE ATENCAO DOMICILIAR| SERVICO DE ATENCAO A SAUDE REPRODUTIVA| SERVICO DE PRATICAS INTEGRATIVAS E COMPLEMENTARES| SERVICO DE LABORATORIO DE HISTOCOMPATIBILIDADE| SERVICO DE ENDOSCOPIA| SERVICO DE ATENCAO CARDIOVASCULAR / CARDIOLOGIA| SERVICO DE LABORATORIO DE HISTOCOMPATIBILIDADE| SERVICO DE ENDOSCOPIA| SERVICO DE FISIOTERAPIA| SERVICO DE DIAGNOSTICO POR LABORATORIO CLINICO| SERVICO DE ONCOLOGIA| SERVICO DE ATENCAO PSICOSSOCIAL| SERVICO DE ORTESES, PROTESES E MAT ESPECIAIS EM REABILITACAO| SERVICO DE DIAGNOSTICO POR ANATOMIA PATOLOGICA EOU CITOPATO| SERVICO DE PNEUMOLOGIA| SERVICO DE FISIOTERAPIA| CIRURGIA VASCULAR| SERVICO DE SUPORTE NUTRICIONAL| SERVICO DE HEMOTERAPIA| SERVICO DE DIAGNOSTICO POR LABORATORIO CLINICO| SERVICO DE PNEUMOLOGIA| SERVICO DE DIAGNOSTICO POR IMAGEM| SERVICO DE ATENCAO CARDIOVASCULAR / CARDIOLOGIA| SERVICO DE HEMOTERAPIA| SERVICO DE ENDOSCOPIA| SERVICO DE ENDOSCOPIA| SERVICO DE ATENCAO CARDIOVASCULAR / CARDIOLOGIA| SERVICO DE DIAGNOSTICO POR IMAGEM| SERVICO DE ATENCAO EM NEUROLOGIA / NEUROCIRURGIA| SERVICO DE ORTESES, PROTESES E MAT ESPECIAIS EM REABILITACAO| SERVICO DE ONCOLOGIA| SERVICO DE TRAUMATOLOGIA E ORTOPEDIA| SERVICO DE DIAGNOSTICO POR IMAGEM| SERVICO DE SUPORTE NUTRICIONAL| ATENCAO A DOENÇA RENAL CRONICA| SERVICO DE PRATICAS INTEGRATIVAS E COMPLEMENTARES| SERVICO DE ATENCAO EM NEUROLOGIA / NEUROCIRURGIA| SERVICO DE ONCOLOGIA| SERVICO DE ORTESES, PROTESES E MAT ESPECIAIS EM REABILITACAO| SERVICO DE TRIAGEM NEONATAL| SERVICO DE ATENCAO CARDIOVASCULAR / CARDIOLOGIA| SERVICO POSTO DE COLETA DE MATERIAIS  BIOLOGICOS| SERVICO DE HEMOTERAPIA| SERVICO DE DIAGNOSTICO POR METODOS GRAFICOS DINAMICOS| SERVICO DE OFTALMOLOGIA| SERVICO DE DIAGNOSTICO POR LABORATORIO CLINICO| SERVICO DE DIAGNOSTICO POR IMAGEM| SERVICO DE ONCOLOGIA| SERVICO DE TRAUMATOLOGIA E ORTOPEDIA| SERVICO DE DIAGNOSTICO POR LABORATORIO CLINICO| MEDICINA NUCLEAR| SERVICO DE REABILITACAO| SERVICO DE HEMOTERAPIA| SERVICO DE ORTESES, PROTESES E MAT ESPECIAIS EM REABILITACAO| SERVICO DE ATENCAO EM NEUROLOGIA / NEUROCIRURGIA| SERVICO DE FISIOTERAPIA| SERVICO DE ATENCAO EM NEUROLOGIA / NEUROCIRURGIA| CIRURGIA VASCULAR| SERVICO DE SUPORTE NUTRICIONAL| SERVICO DE DIAGNOSTICO POR LABORATORIO CLINICO| TRANSPLANTE| SERVICO DE ATENCAO EM NEUROLOGIA / NEUROCIRURGIA| SERVICO DE ATENCAO EM SAUDE BUCAL| SERVICO DE ATENCAO EM NEUROLOGIA / NEUROCIRURGIA| SERVICO DE FISIOTERAPIA| SERVICO DE DIAGNOSTICO POR ANATOMIA PATOLOGICA EOU CITOPATO| SERVICO DE DIAGNOSTICO POR METODOS GRAFICOS DINAMICOS| SERVICO DE FISIOTERAPIA| SERVICO DE DIAGNOSTICO POR LABORATORIO CLINICO| SERVICO DE OFTALMOLOGIA| SERVICO DE ATENCAO PSICOSSOCIAL| SERVICO DE DIAGNOSTICO POR LABORATORIO CLINICO| SERVICO DE URGENCIA E EMERGENCIA| ATENCAO EM UROLOGIA| SERVICO DE DIAGNOSTICO POR METODOS GRAFICOS DINAMICOS| SERVICO DE DIAGNOSTICO POR LABORATORIO CLINICO| TRANSPLANTE| SERVICO DE ATENCAO EM NEUROLOGIA / NEUROCIRURGIA| SERVICO DE FARMACIA| TRANSPLANTE| SERVICO DE VIGILANCIA EM SAUDE| SERVICO DE ORTESES, PROTESES E MAT ESPECIAIS EM REABILITACAO| TRANSPLANTE| SERVICO DE DIAGNOSTICO POR METODOS GRAFICOS DINAMICOS| MEDICINA NUCLEAR| SERVICO DE DIAGNOSTICO POR LABORATORIO CLINICO| SERVICO DE ORTESES, PROTESES E MAT ESPECIAIS EM REABILITACAO| ATENCAO A DOENÇA RENAL CRONICA| SERVICO DE DIAGNOSTICO POR LABORATORIO CLINICO| SERVICO DE DIAGNOSTICO POR LABORATORIO CLINICO| SERVICO DE TRAUMATOLOGIA E ORTOPEDIA| SERVICO DE URGENCIA E EMERGENCIA| SERVICO DE DIAGNOSTICO POR METODOS GRAFICOS DINAMICOS| SERVICO DE ATENCAO CARDIOVASCULAR / CARDIOLOGIA| SERVICO DE VIDEOLAPAROSCOPIA| SERVICO DE FISIOTERAPIA| SERVICO DE ATENCAO DOMICILIAR| SERVICO DE CONTROLE DE TABAGISMO| SERVICO DE DIAGNOSTICO POR IMAGEM| SERVICO DE DIAGNOSTICO POR LABORATORIO CLINICO| ATENCAO A DOENÇA RENAL CRONICA| SERVICO DE DIAGNOSTICO POR IMAGEM",-15.80284,-47.88967,CNES_GEO
7579144,530010,,,A FOCUS DIAGNOSTICO POR IMAGEM E APOIO ADMINISTRATIVO LTDA,A FOCUS DIAGNOSTICOS POR IMAGEM,CLINICA/CENTRO DE ESPECIALIDADE,,,E,STN CJ M ENTRADA B CONS 256 257 258 259 260,S/N,ASA NORTE,70770909,Centro-Oeste,DF,Brasília,35515130,ATENDIMENTOS NOS TURNOS DA MANHA E A TARDE,"SERVICO DE ATENCAO AO PRE-NATAL, PARTO E NASCIMENTO| SERVICO DE DIAGNOSTICO POR IMAGEM",-15.77463,-47.92463,SEDE MUNICIPIO
7711379,530010,,,VILLALVA E AKUAMOA SERVICOS MEDICOS LTDA,RENOVARE UROLOGIA,CLINICA/CENTRO DE ESPECIALIDADE,,,E,SEPS EQ 709 909 CONJUNTO A BLOCO B SALA 413,S/N,ASA SUL,70390095,Centro-Oeste,DF,Brasília,6132977561,ATENDIMENTOS NOS TURNOS DA MANHA E A TARDE,SERVICO DE DIAGNOSTICO POR IMAGEM| ATENCAO EM UROLOGIA,-15.77463,-47.92463,SEDE MUNICIPIO
7646526,530010,,,REDE DOR SAO LUIZ,AMBULATORIO HSL,CLINICA/CENTRO DE ESPECIALIDADE,,,E,STHSL,716,ASA SUL,70390700,Centro-Oeste,DF,Brasília,,ATENDIMENTOS NOS TURNOS DA MANHA E A TARDE,SERVICO DE ONCOLOGIA| SERVICO DE DIAGNOSTICO POR IMAGEM| ATENCAO EM UROLOGIA| SERVICO DE DIAGNOSTICO POR METODOS GRAFICOS DINAMICOS| SERVICO DE DIAGNOSTICO POR ANATOMIA PATOLOGICA EOU CITOPATO| SERVICO DE ONCOLOGIA| SERVICO DE DIAGNOSTICO POR ANATOMIA PATOLOGICA EOU CITOPATO| SERVICO DE CIRURGIA TORACICA| SERVICO DE ATENCAO A SAUDE AUDITIVA| SERVICO DE ENDOSCOPIA,-15.77463,-47.92463,SEDE MUNICIPIO
3667219,530010,,,CENTRO DE REABILITACAO ORAL TANIA MAGALHAES LTDA ME,CENTRO DE REABILITACAO ORAL TANIA MAGALHAES LTDA,CONSULTORIO ISOLADO,,,E,SEP SUL EQ 714 914 CONJUNTO E,S/N,ASA SUL,70390145,Centro-Oeste,DF,Brasília,61 32025322,ATENDIMENTOS NOS TURNOS DA MANHA E A TARDE,SERVICO DE ATENCAO EM SAUDE BUCAL,-15.82332,-47.92631,CNES_GEO
7017413,530010,,,INSTITUTO DE PSICOLOGIA BEM ESTAR LTDA,INSTITUTO DE PSICOLOGIA BEM ESTAR,CONSULTORIO ISOLADO,,,E,SGAS 616 CONJUNTO A BLOCO C SALA,136,ASA SUL,70200760,Centro-Oeste,DF,Brasília,6132744643,ATENDIMENTOS NOS TURNOS DA MANHA E A TARDE,SERVICO DE ATENCAO PSICOSSOCIAL,-15.8269,-47.92902,CNES_GEO
3055450,530010,,,CBV CENTRO BRASILEIRO DA VISAO LTDA,CBV,HOSPITAL ESPECIALIZADO,,,E,SGAS QD 613 CONJ A BL A BL B CONSULT 101 A 108,S/N,ASA SUL,70200730,Centro-Oeste,DF,Brasília,61 32145012,"ATENDIMENTO CONTINUO DE 24 HORAS/DIA (PLANTAO:INCLUI SABADOS, DOMINGOS E FERIADOS)",SERVICO DE OFTALMOLOGIA| SERVICO DE OFTALMOLOGIA| TRANSPLANTE| SERVICO DE OFTALMOLOGIA,-15.81953,-47.92357,CNES_GEO
3211541,530010,,,CLINICA DE MAMOGRAFIA DE BRASILIA LTDA,CLINICA JANICE LAMAS,CLINICA/CENTRO DE ESPECIALIDADE,,,E,SHLS QDA 716 BL F SALAS 301 303 503 504 508 511,S/N,ASA SUL,70390700,Centro-Oeste,DF,Brasília,32135178,ATENDIMENTOS NOS TURNOS DA MANHA E A TARDE,SERVICO DE DIAGNOSTICO POR IMAGEM| SERVICO DE DIAGNOSTICO POR IMAGEM| SERVICO DE DIAGNOSTICO POR IMAGEM| SERVICO DE DIAGNOSTICO POR IMAGEM,-15.82629,-47.9289,CNES_GEO
3438600,530010,,,CARDIOCARE DF CLINICA CARDIOLOGICA SOCIEDADE SIMPLES PURA,CARDIOCARE,CLINICA/CENTRO DE ESPECIALIDADE,,,E,SHLS QD 716 CONJ B BL 05,S/N,ASA SUL,70310500,Centro-Oeste,DF,Brasília,,ATENDIMENTOS NOS TURNOS DA MANHA E A TARDE,SERVICO DE DIAGNOSTICO POR METODOS GRAFICOS DINAMICOS,-15.78014,-47.92916,CNES_GEO
3103714,530010,,,CRIAR CENTRO DE REABILITACAO INTEGRAR LTDA,CRIAR,CLINICA/CENTRO DE ESPECIALIDADE,,,E,SEPS EQ 714 914 CJ A SL 402 404 406 E 408,03,ASA SUL,70390145,Centro-Oeste,DF,Brasília,6132452378,ATENDIMENTOS NOS TURNOS DA MANHA E A TARDE,SERVICO DE FISIOTERAPIA,-15.80655,-47.90396,CNES_GEO
6308325,530010,,,CLINICA ODONTOLOGICA BIOBUCAL LTDA,CLINICA ODONTOLOGICA BIOBUCAL,CONSULTORIO ISOLADO,,,E,SEUPS ENTREQUADRA 709 909 CONJUNTO A BLOCO B,S/N,ASA SUL,70360701,Centro-Oeste,DF,Brasília,999768313,ATENDIMENTOS NOS TURNOS DA MANHA E A TARDE,SERVICO DE ATENCAO EM SAUDE BUCAL,-15.78461,-47.88273,CNES_GEO
3088111,530010,,,IBO INSTITUTO BRASILIENSE DE ODONTOLOGIA SS LTDA,IBO CLINICA E PLANTAO 24 HORAS,CLINICA/CENTRO DE ESPECIALIDADE,,,E,SHC SUL CL QUADRA 406 BLOCO A LOJA,35,ASA SUL,70255510,Centro-Oeste,DF,Brasília,61 32445099,"ATENDIMENTO NOS TURNOS DA MANHA, TARDE E NOITE",SERVICO DE ATENCAO EM SAUDE BUCAL| SERVICO DE ATENCAO EM SAUDE BUCAL| SERVICO DE ATENCAO EM SAUDE BUCAL| SERVICO DE ATENCAO EM SAUDE BUCAL,-16.01068,-48.05994,CNES_GEO
11371,530010,00394700000108,SECRETARIA DE ESTADO DE SAUDE DO DISTRITO FEDERAL,LABORATORIO CENTRAL DE SAUDE PUBLICA DO DISTRITO FEDERAL,LACEN DF,LABORATORIO CENTRAL DE SAUDE PUBLICA LACEN,,,E,SGAN QUADRA 601 LOTES O P,000,ASA NORTE,70830010,Centro-Oeste,DF,Brasília,(61)3255288,"ATENDIMENTO CONTINUO DE 24 HORAS/DIA (PLANTAO:INCLUI SABADOS, DOMINGOS E FERIADOS)",SERVICO DE DIAGNOSTICO POR LABORATORIO CLINICO| SERVICO DE VIGILANCIA EM SAUDE| SERVICO DE DIAGNOSTICO POR LABORATORIO CLINICO| SERVICO DE DIAGNOSTICO POR LABORATORIO CLINICO| SERVICO DE DIAGNOSTICO POR LABORATORIO CLINICO| SERVICO DE VIGILANCIA EM SAUDE| SERVICO DE DIAGNOSTICO POR LABORATORIO CLINICO| SERVICO DE DIAGNOSTICO POR LABORATORIO CLINICO| SERVICO DE VIGILANCIA EM SAUDE| SERVICO DE DIAGNOSTICO POR LABORATORIO CLINICO,-15.78626,-47.87008,CNES_GEO
3956555,530010,,,A2 PSICOLOGIA CULTURA E LAZER NAS EMPRESAS ADM LTDA,A2 PSICOLOGIA CULTURA E LAZER NAS EMPRESAS ADMINISTRACAO,CONSULTORIO ISOLADO,,,E,SGAS QD 910 CJ B BL F SL 32,S/N,ASA SUL,70390100,Centro-Oeste,DF,Brasília,992133124,ATENDIMENTOS NOS TURNOS DA MANHA E A TARDE,SERVICO DE ATENCAO PSICOSSOCIAL,-15.81263,-47.9142,CNES_GEO
3404374,530010,,,INSTITUTO DE MEDICINA NUCLEAR E ENDOCRINOLOGIA DE BRASILIA L,IMEB,UNIDADE DE APOIO DIAGNOSE E TERAPIA (SADT ISOLADO),,,E,SHL SUL QDA 716 CONJUNTO L BLOCO 01,S/N,ASA SUL,70390700,Centro-Oeste,DF,Brasília,,ATENDIMENTOS NOS TURNOS DA MANHA E A TARDE,SERVICO DE DIAGNOSTICO POR IMAGEM| SERVICO DE DIAGNOSTICO POR IMAGEM,-15.82629,-47.9289,CNES_GEO
10723,530010,00394700000108,SECRETARIA DE ESTADO DE SAUDE DO DISTRITO FEDERAL,UNIDADE BASICA DE SAUDE N 3 ASA NORTE,UBS 3 ASA NORTE,CENTRO DE SAUDE/UNIDADE BASICA,,,E,EQN 114 115,01,ASA NORTE,70764400,Centro-Oeste,DF,Brasília,(61)3274-4423,ATENDIMENTOS NOS TURNOS DA MANHA E A TARDE,SERVICO DE PRATICAS INTEGRATIVAS E COMPLEMENTARES| SERVICO DE VIGILANCIA EM SAUDE,-15.7430434226985,-47.8914213180528,PMAQ
7051719,530010,,,FISIOEMOV CLINICA DE FISIOTERAPIA DO MOVIMENTO LTDA,FISIOEMOV,CLINICA/CENTRO DE ESPECIALIDADE,,,E,DE GRANDES AREAS SUL QD 915 CONJUNTO B BLOCO D,13,ASA SUL,70390115,Centro-Oeste,DF,Brasília,61 33451055,ATENDIMENTOS NOS TURNOS DA MANHA E A TARDE,SERVICO DE FISIOTERAPIA,-15.78014,-47.92916,CNES_GEO
3027953,530010,,,LABORATORIO SABIN DE ANALISES CLINICAS,LABORATORIO SABIN HGO,UNIDADE DE APOIO DIAGNOSE E TERAPIA (SADT ISOLADO),,,E,SEPS 710 910 CONJUNTO B BLOCO 1 CONS,06,ASA SUL,70390108,Centro-Oeste,DF,Brasília,33298031,"ATENDIMENTO CONTINUO DE 24 HORAS/DIA (PLANTAO:INCLUI SABADOS, DOMINGOS E FERIADOS)",SERVICO DE DIAGNOSTICO POR LABORATORIO CLINICO| SERVICO DE DIAGNOSTICO POR LABORATORIO CLINICO| SERVICO DE DIAGNOSTICO POR LABORATORIO CLINICO| SERVICO DE DIAGNOSTICO POR LABORATORIO CLINICO| SERVICO DE DIAGNOSTICO POR LABORATORIO CLINICO| SERVICO DE DIAGNOSTICO POR LABORATORIO CLINICO| SERVICO DE DIAGNOSTICO POR LABORATORIO CLINICO| SERVICO DE DIAGNOSTICO POR LABORATORIO CLINICO| SERVICO DE DIAGNOSTICO POR LABORATORIO CLINICO,-15.81317,-47.91184,CNES_GEO
3303462,530010,,,CIMI CENTRO INTEGRADO DE MEDICINA INTERNA DE BRASILIA S S,MEDIGASTRO,CLINICA/CENTRO DE ESPECIALIDADE,,,E,SGAS QD 910 CONJUNTO B BLOCO A SALAS 215 217 219,S/N,ASA SUL,70390100,Centro-Oeste,DF,Brasília,32448753,ATENDIMENTOS NOS TURNOS DA MANHA E A TARDE,SERVICO DE VIDEOLAPAROSCOPIA| SERVICO DE ENDOSCOPIA| SERVICO DE DIAGNOSTICO POR METODOS GRAFICOS DINAMICOS| SERVICO DE DIAGNOSTICO POR IMAGEM,-15.81263,-47.9142,CNES_GEO
5617014,530010,,,CENTRO DE DIAGNOSE E MICROCIRURGIA OCULAR S S,CENTRO DE DIAGNOSE,CLINICA/CENTRO DE ESPECIALIDADE,,,E,SHLS QD 716 BLOCO 02 CONSULTORIOS,19,BRASILIA,70390700,Centro-Oeste,DF,Brasília,32986060,"ATENDIMENTO NOS TURNOS DA MANHA, TARDE E NOITE",SERVICO DE OFTALMOLOGIA| SERVICO DE OFTALMOLOGIA,-15.82629,-47.9289,CNES_GEO
5517680,530010,,,CLINICA RADIOLOGICA E ODONTOLOGICA SAFE CARNEIRO,CLINICA RADIOLOGICA SAFE CARNEIRO,CLINICA/CENTRO DE ESPECIALIDADE,,,E,SDN CONJUNTO A,S/N,ASA NORTE,70077900,Centro-Oeste,DF,Brasília,33277181,ATENDIMENTOS NOS TURNOS DA MANHA E A TARDE,SERVICO DE DIAGNOSTICO POR IMAGEM,-15.79094,-47.88292,CNES_GEO
3212874,530010,,,CLINICA SAO PAULO LTDA,SANARE,CONSULTORIO ISOLADO,,,E,SHL SUL QUADRA 716 CONJUNTO L BLOCO 02 SALA 418,S/N,ASA SUL,70390700,Centro-Oeste,DF,Brasília,(61)33461107,ATENDIMENTOS NOS TURNOS DA MANHA E A TARDE,REGULACAO DE ACESSO A ACOES E SERVICOS DE SAUDE,-15.82629,-47.9289,CNES_GEO
11347,530010,00394700000108,SECRETARIA DE ESTADO DE SAUDE DO DISTRITO FEDERAL,ADOLESCENTRO BRASILIA,ADOLESCENTRO BRASILIA,CLINICA/CENTRO DE ESPECIALIDADE,,,E,SGAS 605,S/N,ASA SUL,70200650,Centro-Oeste,DF,Brasília,(61)4431855,ATENDIMENTOS NOS TURNOS DA MANHA E A TARDE,"SERVICO DE ATENCAO EM SAUDE BUCAL| SERVICO DE PRATICAS INTEGRATIVAS E COMPLEMENTARES| SERVICO DE VIGILANCIA EM SAUDE| SERVICO DE ATENCAO AO PRE-NATAL, PARTO E NASCIMENTO| SERVICO DE ATENCAO PSICOSSOCIAL| ATENÇÃO ÀS PESSOAS EM SITUAÇÃO DE VIOLENCIA SEXUAL",-15.81622,-47.88867,CNES_GEO
3065073,530010,,,MULTICLINICA PONTA NORTE S S ME,IBRAGE INST BRAS GER PREV,POLICLINICA,,,E,STN CONJ O N 30 CONSUL 117 123 131 132 136 139 1,S/N,ASA NORTE,70770100,Centro-Oeste,DF,Brasília,61 32744449,ATENDIMENTOS NOS TURNOS DA MANHA E A TARDE,SERVICO DE DIAGNOSTICO POR METODOS GRAFICOS DINAMICOS| SERVICO DE DIAGNOSTICO POR METODOS GRAFICOS DINAMICOS,-15.73871,-47.89337,CNES_GEO
3028259,530010,,,LAMINA LABORATORIO DE PATOLOGIA E PREVENCAO DE CANCER LTDA,LABORATORIO DE PATOLOGIA E PREVENCAO DE CANCER LTDA,UNIDADE DE APOIO DIAGNOSE E TERAPIA (SADT ISOLADO),,,E,SETOR DE GRANDES AREAS SUL,S/N,ASA SUL,70390150,Centro-Oeste,DF,Brasília,61 33466217,ATENDIMENTOS NOS TURNOS DA MANHA E A TARDE,SERVICO DE DIAGNOSTICO POR ANATOMIA PATOLOGICA EOU CITOPATO,-15.7913,-47.88488,CNES_GEO
6921434,530010,,,ESHO EMPRESA DE SERVICOS HOSPITALARES S A,HOSPITAL ALVORADA DE BRASILIA,HOSPITAL ESPECIALIZADO,,,E,SEP SUL EQ 710 910 CJ B BL I E II,S/N,ASA SUL,70390108,Centro-Oeste,DF,Brasília,61-3038 9607,"ATENDIMENTO CONTINUO DE 24 HORAS/DIA (PLANTAO:INCLUI SABADOS, DOMINGOS E FERIADOS)",SERVICO DE PNEUMOLOGIA| SERVICO DE TERAPIA INTENSIVA| SERVICO DE TRAUMATOLOGIA E ORTOPEDIA| SERVICO DE ONCOLOGIA| SERVICO DE ATENCAO CARDIOVASCULAR / CARDIOLOGIA| SERVICO DE ONCOLOGIA| SERVICO DE TERAPIA INTENSIVA| SERVICO DE CIRURGIA TORACICA| SERVICO DE TRAUMATOLOGIA E ORTOPEDIA| SERVICO DE ATENCAO CARDIOVASCULAR / CARDIOLOGIA| ATENCAO EM UROLOGIA| SERVICO DE URGENCIA E EMERGENCIA,-15.7372,-47.89567,CNES_GEO
11142,530010,00394700000108,SECRETARIA DE ESTADO DE SAUDE DO DISTRITO FEDERAL,CENTRO DE ORIENTACAO MEDICO PSICOPEDAGOGICO COMPP,CENTRO DE ORIENTACAO MEDICO PSICOPEDAGOGICO COMPP,CLINICA/CENTRO DE ESPECIALIDADE,,,E,SMHN CONJ A BL,02,ASA NORTE,70710100,Centro-Oeste,DF,Brasília,(61)33262564,ATENDIMENTOS NOS TURNOS DA MANHA E A TARDE,SERVICO DE DIAGNOSTICO POR METODOS GRAFICOS DINAMICOS| SERVICO DE ATENCAO A SAUDE AUDITIVA| ATENÇÃO ÀS PESSOAS EM SITUAÇÃO DE VIOLENCIA SEXUAL| SERVICO DE REABILITACAO| SERVICO DE ATENCAO PSICOSSOCIAL,-15.85138,-47.95087,CNES_GEO
6609597,530010,,,OFTALMOCLIN OFTALMOLOGIA LTDA ME,OFTALMOCLIN OFTALMOLOGIA,CLINICA/CENTRO DE ESPECIALIDADE,,,E,DE EDIFICIOS DE UTILIDADES PUBLICAS SUL ENTREQUAD,S/N,ASA SUL,70390911,Centro-Oeste,DF,Brasília,61 32234358,ATENDIMENTOS NOS TURNOS DA MANHA E A TARDE,SERVICO DE OFTALMOLOGIA,-15.6508,-47.78045,CNES_GEO
3027899,530010,,,LABORATORIO SABIN DE ANALISES CLINICAS,LABORATORIO SABIN VIA BRASIL,UNIDADE DE APOIO DIAGNOSE E TERAPIA (SADT ISOLADO),,,E,SEP SUL EQ 710 910 CJ D LJ,03,ASA SUL,70390108,Centro-Oeste,DF,Brasília,33298031,ATENDIMENTOS NOS TURNOS DA MANHA E A TARDE,SERVICO DE DIAGNOSTICO POR LABORATORIO CLINICO| SERVICO DE DIAGNOSTICO POR LABORATORIO CLINICO| SERVICO DE DIAGNOSTICO POR LABORATORIO CLINICO| SERVICO DE DIAGNOSTICO POR LABORATORIO CLINICO| SERVICO DE DIAGNOSTICO POR LABORATORIO CLINICO| SERVICO DE DIAGNOSTICO POR LABORATORIO CLINICO| SERVICO DE DIAGNOSTICO POR LABORATORIO CLINICO| SERVICO DE DIAGNOSTICO POR LABORATORIO CLINICO| SERVICO DE DIAGNOSTICO POR LABORATORIO CLINICO,-15.81295,-47.91254,CNES_GEO
2616971,530010,,,DIGIDOC RADIOLOGIA ODONTOLOGICA LTDA,DIGIDOC RADIOLOGIA,CLINICA/CENTRO DE ESPECIALIDADE,,,E,SDN CONJUNTO A,S/N,ASA NORTE,70077900,Centro-Oeste,DF,Brasília,(61) 3030-5406,ATENDIMENTOS NOS TURNOS DA MANHA E A TARDE,SERVICO DE DIAGNOSTICO POR IMAGEM,-15.78014,-47.92916,CNES_GEO
6546293,530010,,,HEMOCLINICA CLINICA DE HEMATOLOGIA E HEMOTERAPIA LTDA,HEMOCLINICA III,CENTRO DE ATENCAO HEMOTERAPIA E OU HEMATOLOGICA,,,E,SHLS QD 716 CONJUNTO E PARTE,S/N,ASA SUL,70390903,Centro-Oeste,DF,Brasília,3433-0217,"ATENDIMENTO CONTINUO DE 24 HORAS/DIA (PLANTAO:INCLUI SABADOS, DOMINGOS E FERIADOS)",SERVICO DE HEMOTERAPIA,-15.78014,-47.92916,CNES_GEO
3083608,530010,,,COC CENTRO ODONTOLOGICO CAETANO LTDA,COC,CONSULTORIO ISOLADO,,,E,SCS QD 01 BLOCO C,30,ASA SUL,70395900,Centro-Oeste,DF,Brasília,32242227,ATENDIMENTOS NOS TURNOS DA MANHA E A TARDE,SERVICO DE ATENCAO EM SAUDE BUCAL,-15.79709,-47.88734,CNES_GEO
5413389,530010,,,PRO FISIO CLINICA DE FISIOTERAPIA LTDA,PRO FISIO,CONSULTORIO ISOLADO,,,E,SGAS 910 CJ B BL E SL 118,S/N,ASA SUL,70390100,Centro-Oeste,DF,Brasília,3244-8953,ATENDIMENTOS NOS TURNOS DA MANHA E A TARDE,SERVICO DE FISIOTERAPIA,-15.81263,-47.9142,CNES_GEO
7259840,530010,,,CLINICA UROGASTRO E ESPECIALIDADES MEDICAS LTDA ME,UROGASTRO,CLINICA/CENTRO DE ESPECIALIDADE,,,E,SEPS EQ 715 915 CONJUNTO A BLOCO E CONSULTORIO,S/N,ASA SUL,70306000,Centro-Oeste,DF,Brasília,6133452836,ATENDIMENTOS NOS TURNOS DA MANHA E A TARDE,ATENCAO A DOENÇA RENAL CRONICA| ATENCAO EM UROLOGIA,-15.78,-47.93,CNES_GEO
5027438,530010,,,REDE DOR SAO LUIZ S A,HOSPITAL DO CORACAO DO BRASIL,HOSPITAL ESPECIALIZADO,,,E,SHLS QUADRA 716 CONJUNTO G,06,ASA SUL,70100000,Centro-Oeste,DF,Brasília,32134031,"ATENDIMENTO CONTINUO DE 24 HORAS/DIA (PLANTAO:INCLUI SABADOS, DOMINGOS E FERIADOS)",CIRURGIA VASCULAR| SERVICO DE ATENCAO CARDIOVASCULAR / CARDIOLOGIA| SERVICO DE DIAGNOSTICO POR METODOS GRAFICOS DINAMICOS| SERVICO DE DIAGNOSTICO POR LABORATORIO CLINICO| SERVICO DE ATENCAO CARDIOVASCULAR / CARDIOLOGIA| CIRURGIA VASCULAR| ATENCAO A DOENÇA RENAL CRONICA| SERVICO DE ATENCAO CARDIOVASCULAR / CARDIOLOGIA| SERVICO DE DIAGNOSTICO POR LABORATORIO CLINICO| ATENCAO A DOENÇA RENAL CRONICA| SERVICO DE DIAGNOSTICO POR ANATOMIA PATOLOGICA EOU CITOPATO| SERVICO DE SUPORTE NUTRICIONAL| SERVICO DE DIAGNOSTICO POR LABORATORIO CLINICO| SERVICO DE ATENCAO CARDIOVASCULAR / CARDIOLOGIA| SERVICO DE FARMACIA| SERVICO DE ATENCAO CARDIOVASCULAR / CARDIOLOGIA| MEDICINA NUCLEAR| SERVICO DE DIAGNOSTICO POR METODOS GRAFICOS DINAMICOS| SERVICO DE DIAGNOSTICO POR LABORATORIO CLINICO| SERVICO DE DIAGNOSTICO POR LABORATORIO CLINICO| SERVICO DE HEMOTERAPIA| SERVICO DE DIAGNOSTICO POR METODOS GRAFICOS DINAMICOS| SERVICO DE DIAGNOSTICO POR LABORATORIO CLINICO| CIRURGIA VASCULAR| SERVICO DE PNEUMOLOGIA| CIRURGIA VASCULAR| SERVICO DE DIAGNOSTICO POR LABORATORIO CLINICO,-15.82629,-47.9289,CNES_GEO
6820123,530010,,,LABORATORIO SABIN DE ANALISES CLINICAS,LABORATORIO SABIN CC SUL,UNIDADE DE APOIO DIAGNOSE E TERAPIA (SADT ISOLADO),,,E,SHLS 716 CONJUNTO L BLOCO 2 CONSUL,7,ASA SUL,70390908,Centro-Oeste,DF,Brasília,33298031,ATENDIMENTOS NOS TURNOS DA MANHA E A TARDE,SERVICO DE DIAGNOSTICO POR LABORATORIO CLINICO| SERVICO DE DIAGNOSTICO POR LABORATORIO CLINICO| SERVICO DE DIAGNOSTICO POR LABORATORIO CLINICO| SERVICO DE DIAGNOSTICO POR LABORATORIO CLINICO| SERVICO DE DIAGNOSTICO POR LABORATORIO CLINICO| SERVICO DE DIAGNOSTICO POR LABORATORIO CLINICO| SERVICO DE DIAGNOSTICO POR LABORATORIO CLINICO| SERVICO DE DIAGNOSTICO POR LABORATORIO CLINICO| SERVICO DE DIAGNOSTICO POR LABORATORIO CLINICO,-15.83433,-47.91029,CNES_GEO
6471455,530010,,,FISIOTRAUMA CLINICA DE FISIOT ESTET E TERAPIAS ALTER LTDA,FISIOTRAUMA,CLINICA/CENTRO DE ESPECIALIDADE,,,E,SHCN COMERCIO LOCAL QUADRA,213,ASA NORTE,70872510,Centro-Oeste,DF,Brasília,6130321884,"ATENDIMENTO NOS TURNOS DA MANHA, TARDE E NOITE",SERVICO DE FISIOTERAPIA,-15.7521,-47.89399,CNES_GEO
3455386,530010,,,INSTITUTO DE MEDICINA NUCLEAR E ENDOCRINOLOGIA DE BRASILIA,IMEB IMAGENS MEDICAS DE BRASILIA FILIAL CROSARA ASA NORTE,UNIDADE DE APOIO DIAGNOSE E TERAPIA (SADT ISOLADO),,,E,SHLN 516 CONJ F EDIFICIO PRIMO CROSARA SALAS,208,ASA NORTE,70770560,Centro-Oeste,DF,Brasília,34740289,ATENDIMENTOS NOS TURNOS DA MANHA E A TARDE,MEDICINA NUCLEAR,-15.82629,-47.9289,CNES_GEO
3548309,530010,,,CLIDENT ODONTOLOGIA INTEGRADA LTDA,CLIDENT,CONSULTORIO ISOLADO,,,E,SRTV NORTE CONJ C N 124 ALA A SALAS,S/N,ASA NORTE,70719903,Centro-Oeste,DF,Brasília,,ATENDIMENTOS NOS TURNOS DA MANHA E A TARDE,SERVICO DE ATENCAO EM SAUDE BUCAL,-15.79808,-47.89365,CNES_GEO
3065057,530010,,,MEDCEU SERVICOS MEDICOS EM IMAGEM LTDA,MEDCEU MEDICINA EM IMAGEM,POLICLINICA,,,E,SHLN CJ I BL B SL 1,101,ASA NORTE,70770573,Centro-Oeste,DF,Brasília,6133470909,ATENDIMENTOS NOS TURNOS DA MANHA E A TARDE,SERVICO DE DIAGNOSTICO POR IMAGEM| SERVICO DE DIAGNOSTICO POR IMAGEM,-16.01068,-48.05994,CNES_GEO
7289871,530010,,,CLINICA DE ATENCAO MEDICA E PSICOSOCIAL LTDA,VIVAMVS INSTITUTO INTERDISCIPLINAR PARA SAUDE MENTAL,CLINICA/CENTRO DE ESPECIALIDADE,,,E,SGAN QUADRA 607 CONJUNTO A BLOCO B SALAS,S/N,ASA NORTE,70830300,Centro-Oeste,DF,Brasília,61 33228184,"ATENDIMENTO NOS TURNOS DA MANHA, TARDE E NOITE",SERVICO DE ATENCAO PSICOSSOCIAL,-15.78014,-47.92916,CNES_GEO
3079252,530010,,,DIAGNOSTICOS DA AMERICA SA,EXAME MEDICINA DIAGNOSTICA ASA NORTE LACLIB,UNIDADE DE APOIO DIAGNOSE E TERAPIA (SADT ISOLADO),,,E,SMHN QUADRA 02 BLOCO A N 10 SOBRELOJAS,123,ASA NORTE,70710904,Centro-Oeste,DF,Brasília,61 - 3433-3200/3206,ATENDIMENTOS NOS TURNOS DA MANHA E A TARDE,SERVICO DE DIAGNOSTICO POR IMAGEM,-15.73871,-47.89337,CNES_GEO
3521842,530010,,,CLINICA DA MAMA DIAGNOSTICO POR IMAGEM LTDA,CLINICA DA MAMA DIAGNOSTICO POR IMAGEM,CLINICA/CENTRO DE ESPECIALIDADE,,,E,SHLS 716 CENTRO CLINICO SUL TORRE II SALAS W,S/N,ASA SUL,70390907,Centro-Oeste,DF,Brasília,,ATENDIMENTOS NOS TURNOS DA MANHA E A TARDE,SERVICO DE DIAGNOSTICO POR IMAGEM,-15.7983,-47.92055,CNES_GEO
6415423,530010,,,ONCOBRASILIA INSTITUTO BRASILIENSE DE ONCOLOGIA CLINICA LTDA,ONCOBRASILIA,CLINICA/CENTRO DE ESPECIALIDADE,,,E,SMHN QD 02 BL C N 44 SALAS 1201 1202 1203 1204,S/N,ASA NORTE,70710149,Centro-Oeste,DF,Brasília,33469081,ATENDIMENTOS NOS TURNOS DA MANHA E A TARDE,SERVICO DE ONCOLOGIA,-15.78014,-47.92916,CNES_GEO
10707,530010,00394700000108,SECRETARIA DE ESTADO DE SAUDE DO DISTRITO FEDERAL,UNIDADE BASICA DE SAUDE N 1 ASA NORTE,UBS 1 ASA NORTE,CENTRO DE SAUDE/UNIDADE BASICA,,,E,SGAN,905,ASA NORTE,70790050,Centro-Oeste,DF,Brasília,(61)3349-0873,ATENDIMENTOS NOS TURNOS DA MANHA E A TARDE,"SERVICO DE VIGILANCIA EM SAUDE| SERVICO DE CONTROLE DE TABAGISMO| SERVICO DE ATENCAO AO PRE-NATAL, PARTO E NASCIMENTO| SERVICO DE PRATICAS INTEGRATIVAS E COMPLEMENTARES",-15.7734704017635,-47.892365455626,PMAQ
3035379,530010,,,GENESIS CENTRO DE ASSISTENCIA EM REPRODUCAO HUMANA LTDA,GENESIS,HOSPITAL ESPECIALIZADO,,,E,SHL SUL QD 716 CJ L BLOCO 01 1 SUB CONSULTORIOS,301303,ASA SUL,70390700,Centro-Oeste,DF,Brasília,30513805,ATENDIMENTOS NOS TURNOS DA MANHA E A TARDE,"SERVICO DE DIAGNOSTICO POR IMAGEM| HOSPITAL DIA| SERVICO DE ATENCAO AO PRE-NATAL, PARTO E NASCIMENTO| SERVICO DE ATENCAO A SAUDE REPRODUTIVA",-15.82629,-47.9289,CNES_GEO
3117901,530010,,,CENTRO ODONTOLOGICO ESPECIALIZADO ALMEIDA LIMA LTDA ME,CENTRO ODONTOLOGICO ESPECIALIZADO ALMEIDA LIMA LTDA,CONSULTORIO ISOLADO,,,E,SGA SUL QD 910 CONJ B BL A SALA 103,S/N,ASA SUL,70381535,Centro-Oeste,DF,Brasília,,"ATENDIMENTO NOS TURNOS DA MANHA, TARDE E NOITE",SERVICO DE ATENCAO EM SAUDE BUCAL,-15.81263,-47.9142,CNES_GEO
7379110,530010,00394700000108,SECRETARIA DE ESTADO DE SAUDE DO DISTRITO FEDERAL,CENTRO DE ATENCAO PSICOSSOCIAL AD INFANTO JUVENIL III BSB,CAPS AD INFANTO JUVENIL III BSB,CENTRO DE ATENCAO PSICOSSOCIAL,,,E,SHCGN 714 715 BLOCO C LOJAS,123,ASA NORTE,70761630,Centro-Oeste,DF,Brasília,33492061,"ATENDIMENTO CONTINUO DE 24 HORAS/DIA (PLANTAO:INCLUI SABADOS, DOMINGOS E FERIADOS)",SERVICO DE ATENCAO PSICOSSOCIAL,-15.78014,-47.92916,CNES_GEO
